{
  "schemaVersion": "1.0",
  "taskId": "task-0001",
  "timestamp": "2025-01-01T10:00:00Z",
  "type": "plan_ready",
  "payload": {
    "planDigest": "sha256:example-digest-of-plan-valid-json",
    "plan": {
      "taskId": "task-0001",
      "userRequest": "Open my editor",
      "summary": "Open the allowlisted editor application.",
      "requiresConfirmation": true,
      "steps": [
        {
          "stepId": 1,
          "actionType": "app.open",
          "arguments": { "appId": "notepad" },
          "riskTier": "T1",
          "preconditions": [{ "type": "app.allowlisted", "args": { "appId": "notepad" } }],
          "postconditions": [{ "type": "window.exists", "args": { "appId": "notepad" } }],
          "timeoutMs": 10000,
          "idempotencyKey": "task-0001-step-1"
        }
      ]
    }
  }
}
